{
  "schemaVersion": 1,
  "source": {
    "kind": "github",
    "repository": "https://github.com/Xpotato1024/browser-prime-toolkit"
  },
  "sourceCommit": "69d12a0a511e00a2e33040eb72f4222ce19a4f97",
  "sourceTreeSha256": "2c926f848f99a0e2e6637da5773f6f321af913d8a9c74be9d129849916b2ef6c",
  "lockSha256": "864f561dfc8b662b6335f2d827dd2525c0e26f918c2e83ec9ece84c6e6c63aa7",
  "manifestSha256": "b992a3e8defff481ddfb9af822c594df147d80739458f31ebc9099e24c3464db",
  "artifactSha256": "1d21b62421930792d5d4dafe501d97e809156330b43d52fb99ecfa588a64d383",
  "reproducibleArtifactSha256": [
    "1d21b62421930792d5d4dafe501d97e809156330b43d52fb99ecfa588a64d383",
    "1d21b62421930792d5d4dafe501d97e809156330b43d52fb99ecfa588a64d383"
  ],
  "review": {
    "reviewer": "independent plugin_contract_review (0744823); exact merge source tree unchanged, clean builds and private dist acceptance reused by executor",
    "scope": "source-and-release",
    "decision": "admit"
  },
  "runtimeReview": {
    "fixedEmbeddedAssets": true,
    "finiteResources": true,
    "cancelUnmountRetirement": true,
    "noComputeNetwork": true,
    "hostSeoOwnership": true
  }
}
